{
  "job_id": "001-post-ux-qa-regression",
  "diff_ref": "b9338dc7a3ae90e948fcd8a4b4e8d0e8a24b2453",
  "generated_at": "2026-10-31T12:07:01.406Z",
  "checks": [
    {
      "check": "format",
      "category": "format",
      "command": "npm run format:check",
      "cwd": "../ethioai-venture-website-factory/001-post-ux-qa-regression",
      "diff_ref": "b9338dc7a3ae90e948fcd8a4b4e8d0e8a24b2453",
      "started_at": "2026-10-31T12:06:31Z",
      "ended_at": "2026-10-31T12:06:33Z",
      "exit_status": 0,
      "output_ref": null,
      "result": "passed",
      "reason": null
    },
    {
      "check": "lint",
      "category": "lint",
      "command": "npm run lint",
      "cwd": "../ethioai-venture-website-factory/001-post-ux-qa-regression",
      "diff_ref": "b9338dc7a3ae90e948fcd8a4b4e8d0e8a24b2453",
      "started_at": "2026-10-31T12:06:33Z",
      "ended_at": "2026-10-31T12:06:35Z",
      "exit_status": 0,
      "output_ref": null,
      "result": "passed",
      "reason": null
    },
    {
      "check": "types",
      "category": "types",
      "command": "npm run typecheck",
      "cwd": "../ethioai-venture-website-factory/001-post-ux-qa-regression",
      "diff_ref": "b9338dc7a3ae90e948fcd8a4b4e8d0e8a24b2453",
      "started_at": "2026-10-31T12:06:35Z",
      "ended_at": "2026-10-31T12:06:40Z",
      "exit_status": 0,
      "output_ref": null,
      "result": "passed",
      "reason": null
    },
    {
      "check": "test",
      "category": "test",
      "command": "npm test",
      "cwd": "../ethioai-venture-website-factory/001-post-ux-qa-regression",
      "diff_ref": "b9338dc7a3ae90e948fcd8a4b4e8d0e8a24b2453",
      "started_at": "2026-10-31T12:06:40Z",
      "ended_at": "2026-10-31T12:06:54Z",
      "exit_status": 0,
      "output_ref": null,
      "result": "passed",
      "reason": null
    },
    {
      "check": "build",
      "category": "build",
      "command": "npm run build",
      "cwd": "../ethioai-venture-website-factory/001-post-ux-qa-regression",
      "diff_ref": "b9338dc7a3ae90e948fcd8a4b4e8d0e8a24b2453",
      "started_at": "2026-10-31T12:06:54Z",
      "ended_at": "2026-10-31T12:06:56Z",
      "exit_status": 0,
      "output_ref": null,
      "result": "passed",
      "reason": null
    },
    {
      "check": "check_dist",
      "category": "custom",
      "command": "npm run check:dist",
      "cwd": "../ethioai-venture-website-factory/001-post-ux-qa-regression",
      "diff_ref": "b9338dc7a3ae90e948fcd8a4b4e8d0e8a24b2453",
      "started_at": "2026-10-31T12:06:56Z",
      "ended_at": "2026-10-31T12:06:56Z",
      "exit_status": 0,
      "output_ref": null,
      "result": "passed",
      "reason": null
    },
    {
      "check": "check_seo",
      "category": "custom",
      "command": "npm run check:seo",
      "cwd": "../ethioai-venture-website-factory/001-post-ux-qa-regression",
      "diff_ref": "b9338dc7a3ae90e948fcd8a4b4e8d0e8a24b2453",
      "started_at": "2026-10-31T12:06:56Z",
      "ended_at": "2026-10-31T12:06:56Z",
      "exit_status": 0,
      "output_ref": null,
      "result": "passed",
      "reason": null
    },
    {
      "check": "check_work",
      "category": "custom",
      "command": "npm run check:work",
      "cwd": "../ethioai-venture-website-factory/001-post-ux-qa-regression",
      "diff_ref": "b9338dc7a3ae90e948fcd8a4b4e8d0e8a24b2453",
      "started_at": "2026-10-31T12:06:56Z",
      "ended_at": "2026-10-31T12:06:56Z",
      "exit_status": 0,
      "output_ref": null,
      "result": "passed",
      "reason": null
    },
    {
      "check": "check_fonts",
      "category": "custom",
      "command": "npm run check:fonts",
      "cwd": "../ethioai-venture-website-factory/001-post-ux-qa-regression",
      "diff_ref": "b9338dc7a3ae90e948fcd8a4b4e8d0e8a24b2453",
      "started_at": "2026-10-31T12:06:56Z",
      "ended_at": "2026-10-31T12:06:57Z",
      "exit_status": 0,
      "output_ref": null,
      "result": "passed",
      "reason": null
    },
    {
      "check": "check_pending",
      "category": "custom",
      "command": "npm run check:pending",
      "cwd": "../ethioai-venture-website-factory/001-post-ux-qa-regression",
      "diff_ref": "b9338dc7a3ae90e948fcd8a4b4e8d0e8a24b2453",
      "started_at": "2026-10-31T12:06:57Z",
      "ended_at": "2026-10-31T12:06:57Z",
      "exit_status": 0,
      "output_ref": null,
      "result": "passed",
      "reason": null
    },
    {
      "check": "check_a11y",
      "category": "custom",
      "command": "npm run check:a11y",
      "cwd": "../ethioai-venture-website-factory/001-post-ux-qa-regression",
      "diff_ref": "b9338dc7a3ae90e948fcd8a4b4e8d0e8a24b2453",
      "started_at": "2026-10-31T12:06:57Z",
      "ended_at": "2026-10-31T12:06:57Z",
      "exit_status": 0,
      "output_ref": null,
      "result": "passed",
      "reason": null
    }
  ]
}